{
  "$schema": "http://json-schema.org/draft-07/schema#",
  "$id": "https://raw.githubusercontent.com/lliangcol/llm-plugins-fusion/main/schemas/plugin.schema.json",
  "title": "Nova Plugin Metadata",
  "description": "Schema for nova-plugin/.claude-plugin/plugin.json, aligned with Claude plugin validation. Marketplace-only fields belong in .claude-plugin/marketplace.json.",
  "type": "object",
  "required": ["name", "description", "version", "author"],
  "additionalProperties": false,
  "properties": {
    "name": {
      "type": "string",
      "minLength": 1,
      "pattern": "^[a-z0-9](-?[a-z0-9])*$",
      "description": "Plugin identifier, lowercase with hyphens"
    },
    "description": {
      "type": "string",
      "minLength": 10,
      "description": "Short description of the plugin"
    },
    "version": {
      "type": "string",
      "pattern": "^\\d+\\.\\d+\\.\\d+$",
      "description": "Semantic version (e.g. 1.0.6)"
    },
    "author": {
      "type": "object",
      "required": ["name"],
      "additionalProperties": true,
      "properties": {
        "name": { "type": "string", "minLength": 1 },
        "email": { "type": "string", "format": "email" },
        "url": { "type": "string", "format": "uri" }
      }
    },
    "license": {
      "type": "string",
      "description": "SPDX license identifier (e.g. MIT)"
    },
    "keywords": {
      "type": "array",
      "items": { "type": "string", "minLength": 1 },
      "uniqueItems": true,
      "description": "Search keywords"
    },
    "homepage": { "type": "string", "format": "uri" },
    "repository": { "type": "string", "format": "uri" },
    "icon": { "type": "string" }
  }
}
