{
  "name": "nova-plugin",
  "description": "nova-plugin is a Claude Code compatible workflow plugin for AI coding assistants. It provides Explore, Plan, Review, Implement, and Finalize command/skill contracts, consumer profile guidance, and validation-aware handoff patterns for multi-project engineering work.",
  "version": "3.0.1",
  "author": {
    "name": "liu liang",
    "email": "lliangcoder@gmail.com",
    "url": "https://github.com/lliangcol"
  },
  "license": "MIT",
  "keywords": ["explore", "plan", "review", "implement", "finalize", "codex"],
  "homepage": "https://github.com/lliangcol/llm-plugins-fusion",
  "repository": "https://github.com/lliangcol/llm-plugins-fusion"
}
